{
    "issuer": "https://auth.example.com",
    "authorization_endpoint": "https://auth.example.com/authorize",
    "token_endpoint": "https://auth.example.com/token",
    "jwks_uri": "https://auth.example.com/jwks.json",
    "registration_endpoint": "https://auth.example.com/register",
    "scopes_supported": ["openid", "profile", "email"],
    "response_types_supported": ["code", "token", "id_token"],
    "response_modes_supported": ["query", "fragment", "form_post"],
    "grant_types_supported": ["authorization_code", "client_credentials"],
    "token_endpoint_auth_methods_supported": ["client_secret_basic", "private_key_jwt"],
    "token_endpoint_auth_signing_alg_values_supported": ["RS256", "ES256"],
    "service_documentation": "https://auth.example.com/docs",
    "ui_locales_supported": ["en", "de", "fr"],
    "op_policy_uri": "https://auth.example.com/policy",
    "op_tos_uri": "https://auth.example.com/tos",
    "revocation_endpoint": "https://auth.example.com/revoke",
    "revocation_endpoint_auth_methods_supported": ["client_secret_basic"],
    "revocation_endpoint_auth_signing_alg_values_supported": ["RS256"],
    "introspection_endpoint": "https://auth.example.com/introspect",
    "introspection_endpoint_auth_methods_supported": ["client_secret_post"],
    "introspection_endpoint_auth_signing_alg_values_supported": ["RS256"],
    "code_challenge_methods_supported": ["S256", "plain"],
    "pre-authorized_grant_anonymous_access_supported": false
}
